<?xml version="1.0" encoding="utf-8" ?>
<TaskList xmlns:xsi="http://www.w3.org/2001/XMLSchema-instance" xsi:noNamespaceSchemaLocation="tasklist.xsd">
  <Task Name="Update" ThreadCount="1" StartType="Interval" Hours="0" Minutes="5" Type="Tango.TaskManager.WebClient" Method="Post">
    <Argument Name="url" Value="http://localhost:53885/longoperation/updatequeue?conn=231" />
    <Argument Name="userName" Value="" />
    <Argument Name="password" Value="" />
    <Argument Name="timeOut" Value="600" />
	  <Dictionary Name="data">
		  <Argument Name="system_id" Value="1,2" />
	  </Dictionary>
  </Task>
  <Task Name="Run" StartType="Interval" Hours="0" Minutes="5" Type="Tango.TaskManager.WebClient" Method="Post">
    <Argument Name="url" Value="http://localhost:53885/longoperation/runtask?conn=231" />
    <Argument Name="userName" Value="" />
    <Argument Name="password" Value="" />
    <Argument Name="timeOut" Value="600" />
  </Task>
</TaskList>